question,answer,score,feedback
"What techniques did you employ to achieve successful deployment of the 'Chat with Database' project at Dhyey Consulting, and how did you use technologies like Hugging Face, LangChain, and OpenAI?",I don't know,0,"The answer is not relevant to the question and does not provide any information about the techniques used or the technologies mentioned. It lacks accuracy, completeness, and relevance."
"Can you describe your experience with containerization using Docker, particularly in the context of ensuring seamless deployment across multiple environments?",,0,The answer is missing. It does not provide any information about the candidate's experience with Docker or deployment across multiple environments.
"At Techxi, you developed various machine learning applications such as PDF ChatBots and image generation tools. Could you walk us through one of these projects, including the tools and methods you used?",,0,"The answer is missing. It does not provide any information about the candidate's projects, tools, or methods used in developing machine learning applications."
"How have you utilized LangChain and GrooqAI in your previous roles, and what specific benefits did they bring to your projects?",,0,"The answer is missing. It does not provide any information about the candidate's utilization of LangChain and GrooqAI, nor the benefits these technologies brought to their projects."
"Given your experience with AWS, can you explain a particularly complex cloud solution you implemented and the challenges you faced during its deployment?",,0,The answer is missing. It does not provide any information about a complex cloud solution implemented by the candidate or the challenges faced during its deployment.
